{
  "claim_limits": [
    "This proves one isolated prerelease Codex pair, not a production Codex cutover.",
    "The current conformance-suite mismatch remains an independent migration blocker.",
    "Existing handle and cache receipts remain separate evidence for requestState and subscription semantics.",
    "The KAG result is navigation evidence and does not move owner authority.",
    "No candidate, effect, memory acceptance, proof verdict, source mutation, or production registration occurred."
  ],
  "consumer": {
    "binary_sha256": "8185beb794bf7374ecac1a5db7ff06611c708e4806b8b85d3b1f7cdbd7aa2826",
    "feature": "mcp_2026_07_28",
    "feature_default": false,
    "production_authority": false,
    "version": "0.147.0-alpha.4"
  },
  "expires_at": "2026-08-09T00:05:07Z",
  "finished_at": "2026-08-02T00:05:25.682969Z",
  "observation_id": "codex-0.147.0-alpha.4-kag-next-lab-20260801",
  "observed_at": "2026-08-02T00:05:07.346034Z",
  "private_evidence": {
    "normalized_from": "local:///srv/abyss-machine/cache/mcp-protocol-modern-lab/codex-kag-next-lab-private.json",
    "raw_receipt_sha256": "5d26678e07f111aaaefac28196cee110570f0d671bc65f8656e55d74d8a9d644",
    "server_record_sha256": "3b1e5a50ccd5c08278ad6aa53b5c6bc0102084d1ac432062ce77c0726d456017"
  },
  "rollback": {
    "app_process_stopped": true,
    "credential_removed": true,
    "port_closed": true,
    "registration_removed": true,
    "server_process_stopped": true
  },
  "schema_version": "abyss_mcp_codex_kag_next_lab_observation_v1",
  "server": {
    "credential_regular_non_symlink_0600": true,
    "endpoint": "http://127.0.0.1:5441/mcp",
    "python_mcp_version": "2.0.0",
    "registration": "aoa_kag_next_lab",
    "source_artifacts": {
      "adapter_harness_sha256": "530066f8098b28f188fff6c2af87a63f0f7bfd6f145f96e018311b019a0b362c",
      "adapter_package_tree_sha256": "92dc85946802fc917bc832c9ab59d78a08494c5819b2e22abca769223d754cd3",
      "driver_sha256": "7c272928384bc1d9afb0ad3c0492808d25cc7c0a00a863805be378e9db8fb4dd"
    },
    "source_revisions": {
      "abyss_stack": "9cabe283f20f2d0b2861aaad061d2049d6878375",
      "aoa_kag": "ba7805190527a635ff5c515701be29379af8277f"
    }
  },
  "stable_registration": {
    "config_sha256_after": "8d6d38d17e52cb9fe5160270c41dac56a1b4191bcec76b8d5c9a0ce1e867d063",
    "config_sha256_before": "8d6d38d17e52cb9fe5160270c41dac56a1b4191bcec76b8d5c9a0ce1e867d063",
    "unchanged": true
  },
  "verdict": "isolated_prerelease_pair_passed",
  "wire": {
    "authenticated_principal": {
      "client_id": "https://os-abyss.invalid/codex-kag-next-lab.json",
      "issuer": "https://auth.os-abyss.invalid",
      "subject": "codex-kag-next-lab"
    },
    "initialize_observed": false,
    "input_limit_bytes": 16384,
    "mcp_session_id_observed": false,
    "output_limit_bytes": 262144,
    "oversized_input_denied_code": -32602,
    "oversized_input_http_status": 400,
    "owner": "abyss-stack",
    "request_bytes": 45,
    "response_bytes": 7660,
    "result_schema": "aoa-kag-mcp-capabilities-v1",
    "self_describing_requests": 9,
    "server_discover_observed": true,
    "tool_call": "kag_discover",
    "tool_inventory": [
      "kag_discover"
    ],
    "tool_schema_sha256": "745e6e7999cadc40804772b40a52e29df3c5cee13459324e21518e585612ba0c",
    "trace_observed": "00-7d6f4bfe66cc42c7be4dfe186f08bd47-e0ad439d3c018890-01",
    "trace_sent": "00-7d6f4bfe66cc42c7be4dfe186f08bd47-e0ad439d3c018890-01",
    "version": "2026-07-28",
    "wrong_bearer_http_status": 401
  }
}
